{"coverage":{"branch":"NO_EVIDENCE","history":"NO HISTORICAL EVIDENCE","identity":"EXACT","passport":"NO_EVIDENCE","permission":"NO_EVIDENCE","provenance":"COVERED","registration":"COVERED","sanction":"NO_EVIDENCE","warning":"NO_EVIDENCE"},"freshness":{"last_successful_refresh":"2026-09-18T20:07:52Z","source_status":"OK"},"id":"sgiic-a85853927","identity":{"aliases":[],"identifiers":[{"scheme":"es:nif","value":"A85853927"},{"scheme":"cnmv:registro","value":"238"}],"legal_name":"ABACO CAPITAL, SGIIC, S.A.","resolution":"EXACT"},"locations":{"agents":[],"branches":[],"domicile":"Paseo General Martínez Campos 47 - 28010 Madrid (Madrid)","passporting":[]},"managed_entities":[{"kind":"FUND","name":"ABACO GLOBAL VALUE OPPORTUNITIES FI","register_number":"4827","type":"Fondo de inversión"},{"kind":"FUND","name":"ABACO RENTA FIJA MIXTA GLOBAL, FI","register_number":"4474","type":"Fondo de inversión"},{"kind":"FUND","name":"ABACO RENTA FIJA, FI","register_number":"5550","type":"Fondo de inversión"}],"organisation":{"administrators":[{"appointed":"09/05/2014","name":"GONZALEZ LOPEZ, PABLO FERNANDO","role":"PRESIDENTE"},{"appointed":"09/05/2014","name":"GONZALEZ LOPEZ, PABLO FERNANDO","role":"CONSEJERO DELEGADO"},{"appointed":"09/05/2014","name":"COSTALES ARITIO, JOSE","role":"CONSEJERO"},{"appointed":"09/05/2014","name":"GONZALEZ LOPEZ, PABLO FERNANDO","role":"CONSEJERO"},{"appointed":"17/06/2024","name":"HERRUZO NOGUERA, CECILIA","role":"CONSEJERO"},{"appointed":"30/10/2020","name":"PONT LOPEZ, MARIA","role":"CONSEJERO"},{"appointed":"23/06/2023","name":"PONT LOPEZ, MARIA","role":"SECRETARIO"}],"auditor":"LUQUE VELASCO AUDITORES SL","audits":[{"auditor":"LUQUE VELASCO AUDITORES SL","year":"2025"},{"auditor":"LUQUE VELASCO AUDITORES SL","year":"2024"},{"auditor":"LUQUE VELASCO AUDITORES SL","year":"2023"},{"auditor":"LUQUE VELASCO AUDITORES SL","year":"2022"},{"auditor":"LUQUE VELASCO AUDITORES SL","year":"2021"},{"auditor":"LUQUE VELASCO AUDITORES SL","year":"2020"},{"auditor":"LUQUE VELASCO AUDITORES SL","year":"2019"},{"auditor":"LUQUE VELASCO AUDITORES SL","year":"2018"},{"auditor":"LUQUEVELASCO Auditores,S.L.","year":"2017"},{"auditor":"LUQUEVELASCO Auditores,S.L.","year":"2016"},{"auditor":"LUQUEVELASCO Auditores,S.L.","year":"2015"}],"customer_service":{"address":"CLAUDIO COELLO 124, 6 IZDA.","locality":"MADRID","name":"JOSE COSTALES ARITIO","phone":"915639099","postal_code":"28006","province":"MADRID","web":"www.abaco-capital.com"},"shareholders":[{"name":"COSTALES ARITIO, JOSE","pct":"10,00 %"},{"name":"GONZALEZ BLANCO, MARIA CRISTINA","pct":"23,50 %"},{"name":"GONZALEZ LOPEZ, PABLO FERNANDO","pct":"64,70 %"}]},"permissions":[],"registrations":[{"basis":"OFFICIAL_AS_OF_STATE","date":"09/05/2014","number":"238","register":"CNMV_SGIIC","regulator":"CNMV","state":"INSCRITA"}],"regulatory_record":{"appeals":[],"candidates":[],"direct_warnings":[],"impersonations":[],"sanctions":[]},"schema":"regulatory-record-entity/v1","sources":[{"requested_fs":null,"retrieved_at":"2026-09-19T06:08:50Z","sha256":"3c627df1d7a0f750389208d3a487d6fc2075e3400d21ca776b954e28b2ea2cd3","source":"CNMV_PORTAL","url":"https://www.cnmv.es/portal/consultas/iic/sgiic.aspx?nif=A85853927&vista=5"},{"requested_fs":null,"retrieved_at":"2026-09-19T06:08:51Z","sha256":"4f5c20157fc37d79b1386f338aabf731a67beb59618b1ec02a7a26e451fc6667","source":"CNMV_PORTAL","url":"https://www.cnmv.es/portal/consultas/iic/sgiic.aspx?nif=A85853927&vista=6"},{"requested_fs":null,"retrieved_at":"2026-09-19T06:08:53Z","sha256":"5c1d2502d14f2619a3050d312c88ac4dc9c3f58b68a94685e5b529f4fa69f47b","source":"CNMV_PORTAL","url":"https://www.cnmv.es/portal/consultas/iic/sgiic.aspx?nif=A85853927&vista=10"},{"requested_fs":null,"retrieved_at":"2026-09-19T06:08:54Z","sha256":"05cbd1956d42ea2fe163e71218aeba2dab8619d209be3bda54b32aed109e6b8a","source":"CNMV_PORTAL","url":"https://www.cnmv.es/portal/consultas/iic/sgiic.aspx?nif=A85853927&vista=11"},{"requested_fs":null,"retrieved_at":"2026-09-19T06:08:56Z","sha256":"d101e9ff22ed085c6696e812dbcded520b9cd08219daee52c6b19f70330ec292","source":"CNMV_PORTAL","url":"https://www.cnmv.es/portal/consultas/iic/sgiic.aspx?nif=A85853927&vista=12"},{"requested_fs":null,"retrieved_at":"2026-09-19T06:08:57Z","sha256":"0b714ebd2ca86f3452aa598fa5be8e2895e24d68999de35b30a390e533f6dd64","source":"CNMV_PORTAL","url":"https://www.cnmv.es/portal/consultas/iic/sgiic.aspx?nif=A85853927&vista=13"},{"requested_fs":null,"retrieved_at":"2026-09-19T06:08:59Z","sha256":"0f6f31ecbb6ae6b47722223199fe3751ed00c3148c6ea1b83ae1d3614744cb90","source":"CNMV_PORTAL","url":"https://www.cnmv.es/portal/consultas/iic/sgiic.aspx?nif=A85853927&vista=16"},{"requested_fs":null,"retrieved_at":"2026-09-19T06:09:01Z","sha256":"e65bd5bf95da01b963fa76cf104b5851851d0bf6e63c8ddc2c76770cb2b1d2ea","source":"CNMV_PORTAL","url":"https://www.cnmv.es/portal/consultas/iic/sgiic.aspx?nif=A85853927&vista=38"},{"requested_fs":null,"retrieved_at":"2026-09-18T20:07:52Z","sha256":"2df1fc03744d50b1d7b002bee195866b6e1d307f64080f785f11fdb28d761d59","source":"CNMV_PORTAL","url":"https://www.cnmv.es/portal/consultas/iic/sgiic.aspx?nif=A85853927"},{"requested_fs":"18/09/2025","retrieved_at":"2026-09-18T20:07:54Z","sha256":"071287afd4e9d2bd2fd52f224e81b290976a8f4fb1065d54a8eeb4697b67bc15","source":"CNMV_PORTAL","url":"https://www.cnmv.es/portal/consultas/iic/sgiic.aspx?nif=A85853927&fs=18%2F09%2F2025"},{"requested_fs":"18/09/2023","retrieved_at":"2026-09-18T20:07:56Z","sha256":"d0ead19a820e05e970708b2bf8d804902b995f3e04f9f351aa82e33eda7d64f4","source":"CNMV_PORTAL","url":"https://www.cnmv.es/portal/consultas/iic/sgiic.aspx?nif=A85853927&fs=18%2F09%2F2023"},{"requested_fs":"18/09/2021","retrieved_at":"2026-09-18T20:07:58Z","sha256":"be9908f1536b1b982abbe09f134519a8206e674b8bf7a1e224f2693139e67340","source":"CNMV_PORTAL","url":"https://www.cnmv.es/portal/consultas/iic/sgiic.aspx?nif=A85853927&fs=18%2F09%2F2021"},{"requested_fs":null,"retrieved_at":"2026-09-18T20:07:59Z","sha256":"43bc8193dce864acd728921e9e225a14c57f9bcc85b7d9152da96307de67804b","source":"CNMV_PORTAL","url":"https://www.cnmv.es/portal/consultas/iic/sgiic.aspx?nif=A85853927&vista=4"},{"requested_fs":null,"retrieved_at":"2026-09-18T20:08:01Z","sha256":"403852db614d69cbebeed9411c5119acb97cebb0f4ea435586e7168b0656c284","source":"CNMV_PORTAL","url":"https://www.cnmv.es/portal/consultas/iic/sgiic.aspx?nif=A85853927&vista=7"},{"requested_fs":null,"retrieved_at":"2026-09-18T20:08:03Z","sha256":"da59060e5d47e44f7fd624c03d589d6fde1eefb5f3a6983ec6cc6b23a93027bc","source":"CNMV_PORTAL","url":"https://www.cnmv.es/portal/consultas/iic/sgiic.aspx?nif=A85853927&vista=9"},{"requested_fs":null,"retrieved_at":"2026-09-18T20:08:04Z","sha256":"a48f5d62c32ec41e59d94a94ee57bc2b9d9aaba0f9625be4320ac8bec4e5d3eb","source":"CNMV_PORTAL","url":"https://www.cnmv.es/portal/consultas/iic/sgiic.aspx?nif=A85853927&vista=17"},{"requested_fs":null,"retrieved_at":"2026-09-18T20:08:06Z","sha256":"6e488dead95261d5353cdff080945a1624743b9d4f659853861fe3983cfd60da","source":"CNMV_PORTAL","url":"https://www.cnmv.es/portal/consultas/iic/sgiic.aspx?nif=A85853927&vista=20"}],"status":{"as_of":"2026-09-18","basis":"OFFICIAL_AS_OF_STATE","value":"REGISTERED"},"timeline":[{"date_or_interval":"18/09/2025","evidence":"071287afd4e9d2bd2fd52f224e81b290976a8f4fb1065d54a8eeb4697b67bc15","kind":"OFFICIAL_AS_OF_STATE","summary":"Estado servido por la fuente para fs=18/09/2025: dirección «Paseo General Martínez Campos 47 - 28010 Madrid (Madrid)», capital 450.000,00"},{"date_or_interval":"18/09/2023","evidence":"d0ead19a820e05e970708b2bf8d804902b995f3e04f9f351aa82e33eda7d64f4","kind":"OFFICIAL_AS_OF_STATE","summary":"Estado servido por la fuente para fs=18/09/2023: dirección «Paseo General Martínez Campos 47 - 28010 Madrid (Madrid)», capital 450.000,00"},{"date_or_interval":"18/09/2021","evidence":"be9908f1536b1b982abbe09f134519a8206e674b8bf7a1e224f2693139e67340","kind":"OFFICIAL_AS_OF_STATE","summary":"Estado servido por la fuente para fs=18/09/2021: dirección «Paseo General Martínez Campos 47 - 28010 Madrid (Madrid)», capital 450.000,00"},{"date_or_interval":"09/05/2014","evidence":"2df1fc03744d50b1d7b002bee195866b6e1d307f64080f785f11fdb28d761d59","kind":"EXPLICIT_OFFICIAL_EVENT","summary":"Inscripción en el registro oficial CNMV nº 238"},{"date_or_interval":"09/05/2014","evidence":"vista_4","kind":"EXPLICIT_OFFICIAL_EVENT","summary":"Nombramiento: GONZALEZ LOPEZ, PABLO FERNANDO — PRESIDENTE"},{"date_or_interval":"09/05/2014","evidence":"vista_4","kind":"EXPLICIT_OFFICIAL_EVENT","summary":"Nombramiento: GONZALEZ LOPEZ, PABLO FERNANDO — CONSEJERO DELEGADO"},{"date_or_interval":"09/05/2014","evidence":"vista_4","kind":"EXPLICIT_OFFICIAL_EVENT","summary":"Nombramiento: COSTALES ARITIO, JOSE — CONSEJERO"},{"date_or_interval":"09/05/2014","evidence":"vista_4","kind":"EXPLICIT_OFFICIAL_EVENT","summary":"Nombramiento: GONZALEZ LOPEZ, PABLO FERNANDO — CONSEJERO"},{"date_or_interval":"17/06/2024","evidence":"vista_4","kind":"EXPLICIT_OFFICIAL_EVENT","summary":"Nombramiento: HERRUZO NOGUERA, CECILIA — CONSEJERO"},{"date_or_interval":"30/10/2020","evidence":"vista_4","kind":"EXPLICIT_OFFICIAL_EVENT","summary":"Nombramiento: PONT LOPEZ, MARIA — CONSEJERO"},{"date_or_interval":"23/06/2023","evidence":"vista_4","kind":"EXPLICIT_OFFICIAL_EVENT","summary":"Nombramiento: PONT LOPEZ, MARIA — SECRETARIO"}]}