{"coverage":{"branch":"NO_EVIDENCE","history":"COVERED","identity":"EXACT","passport":"NO_EVIDENCE","permission":"NO_EVIDENCE","provenance":"COVERED","registration":"COVERED","sanction":"NOT_REPRESENTABLE","warning":"NO_EVIDENCE"},"freshness":{"last_successful_refresh":"2026-09-13","source_status":"OK"},"id":"ins-c0003","identity":{"aliases":[],"identifiers":[{"scheme":"dgsfp:clave","value":"C0003"},{"scheme":"es:nif","value":"A28044352"}],"legal_name":"ALIANZA MEDICA DEL COMERCIO Y DE LA INDUSTRIA, S.A. CIA DE SEGUROS","resolution":"EXACT"},"locations":{"agents":[],"branches":[],"domicile":"UNKNOWN","passporting":[]},"managed_entities":[],"organisation":{"administrators":[],"entity_kind":"INSURANCE_UNDERTAKING","shareholders":[]},"permissions":"UNKNOWN","registrations":[{"basis":"OFFICIAL_AS_OF_STATE","cancelled":null,"date":"02/02/1956","number":"C0003","register":"DGSFP_RRPP","register_type":"C","regulator":"DGSFP","state":"Cancelada"}],"regulatory_record":{"appeals":[],"candidates":[],"direct_warnings":[],"impersonations":[],"sanctions":[]},"schema":"regulatory-record-entity/v1","sources":[{"artifact":"data/derived/v0.1/opendgsfp-0.1.jsonl","schema":"opendgsfp/0.1","sha256":"10eb1274d3023fbb3e4bb81aff180d3353e889f64fd85c3eb62633fa367aec82","source":"OPENDGSFP"}],"status":{"as_of":"2026-09-13","basis":"OFFICIAL_AS_OF_STATE","source_value":"Cancelada","value":"DEREGISTERED"},"timeline":[{"date_or_interval":"2026-09-13","evidence":"as_5421caf2d9c212e2","kind":"OFFICIAL_AS_OF_STATE","summary":"Estado DGSFP «Cancelada» observado en snapshot 2026-09-13"},{"date_or_interval":"02/02/1956","evidence":"as_5421caf2d9c212e2","kind":"EXPLICIT_OFFICIAL_EVENT","summary":"Autorización DGSFP (C0003)"},{"date_or_interval":["UNKNOWN","2026-09-13"],"evidence":"10eb1274d3023fbb3e4bb81aff180d3353e889f64fd85c3eb62633fa367aec82","kind":"OBSERVED_CHANGE","summary":"Entidad cancelada en el registro DGSFP; fecha exacta de baja no disponible en el artefacto (límite acotado)"}]}