{"coverage":{"branch":"NO_EVIDENCE","history":"NO HISTORICAL EVIDENCE","identity":"EXACT","passport":"NO_EVIDENCE","permission":"NO_EVIDENCE","provenance":"COVERED","registration":"COVERED","sanction":"NO_EVIDENCE","warning":"NO_EVIDENCE"},"freshness":{"last_successful_refresh":"2026-09-18T20:07:37Z","source_status":"OK"},"id":"sgiic-a83133421","identity":{"aliases":[],"identifiers":[{"scheme":"es:nif","value":"A83133421"},{"scheme":"cnmv:registro","value":"195"}],"legal_name":"A&G FONDOS, SGIIC, SA","resolution":"EXACT"},"locations":{"agents":[],"branches":[],"domicile":"PASEO DE LA CASTELLANA, 92 - 28046 MADRID (MADRID)","passporting":"UNKNOWN"},"organisation":{"administrators":[{"appointed":"22/03/2017","name":"FERNANDEZ ELICES, DIEGO","role":"PRESIDENTE"},{"appointed":"01/12/2010","name":"ESPEL SESE, JUAN","role":"CONSEJERO"},{"appointed":"22/03/2017","name":"FERNANDEZ ELICES, DIEGO","role":"CONSEJERO"},{"appointed":"22/03/2017","name":"SOLDEVILLA DIEGO, RAFAEL","role":"CONSEJERO"}],"shareholders":[{"name":"ASESORES Y GESTORES FINANCIEROS , S.A.","pct":"99,99 %"}]},"permissions":[],"registrations":[{"basis":"OFFICIAL_AS_OF_STATE","date":"25/01/2002","number":"195","register":"CNMV_SGIIC","regulator":"CNMV","state":"INSCRITA"}],"regulatory_record":{"appeals":[],"candidates":[],"direct_warnings":[],"impersonations":[],"sanctions":[]},"schema":"regulatory-record-entity/v1","sources":[{"requested_fs":null,"retrieved_at":"2026-09-18T20:07:37Z","sha256":"4457d40bddb065ec8f88fab602735d250349132f658792af7e64e8d672d0c570","source":"CNMV_PORTAL","url":"https://www.cnmv.es/portal/consultas/iic/sgiic.aspx?nif=A83133421"},{"requested_fs":"18/09/2025","retrieved_at":"2026-09-18T20:07:39Z","sha256":"464b2690bb938ec6a9493887a881a71d1af7ab503a05add6aa0256bed40e4e03","source":"CNMV_PORTAL","url":"https://www.cnmv.es/portal/consultas/iic/sgiic.aspx?nif=A83133421&fs=18%2F09%2F2025"},{"requested_fs":"18/09/2023","retrieved_at":"2026-09-18T20:07:40Z","sha256":"9379ec226934bdc7b1f93c23d0fb0985b364464604f039fda3d9917ce8218b8b","source":"CNMV_PORTAL","url":"https://www.cnmv.es/portal/consultas/iic/sgiic.aspx?nif=A83133421&fs=18%2F09%2F2023"},{"requested_fs":"18/09/2021","retrieved_at":"2026-09-18T20:07:42Z","sha256":"62d6bba31b7266d0359b0f01c3999a129a40af09ea17999815aefa3c11154e09","source":"CNMV_PORTAL","url":"https://www.cnmv.es/portal/consultas/iic/sgiic.aspx?nif=A83133421&fs=18%2F09%2F2021"},{"requested_fs":null,"retrieved_at":"2026-09-18T20:07:44Z","sha256":"edf2e2868153c17291cd23a166e05d26040f5a5c61eb7e300ebe554c84b65ad3","source":"CNMV_PORTAL","url":"https://www.cnmv.es/portal/consultas/iic/sgiic.aspx?nif=A83133421&vista=4"},{"requested_fs":null,"retrieved_at":"2026-09-18T20:07:46Z","sha256":"fd005b7b8c65a802d723f37b2de573197743a11b907790aa0161074224451092","source":"CNMV_PORTAL","url":"https://www.cnmv.es/portal/consultas/iic/sgiic.aspx?nif=A83133421&vista=7"},{"requested_fs":null,"retrieved_at":"2026-09-18T20:07:47Z","sha256":"c051042f12803e54d8d370862bfceb07bf91d167be850508cdf5d7b9bd705c39","source":"CNMV_PORTAL","url":"https://www.cnmv.es/portal/consultas/iic/sgiic.aspx?nif=A83133421&vista=9"},{"requested_fs":null,"retrieved_at":"2026-09-18T20:07:49Z","sha256":"999fe499dcdeb06ee907acbf819d233a95e0145c4d8d71c16a4eb32c10a3594d","source":"CNMV_PORTAL","url":"https://www.cnmv.es/portal/consultas/iic/sgiic.aspx?nif=A83133421&vista=17"},{"requested_fs":null,"retrieved_at":"2026-09-18T20:07:51Z","sha256":"049f9a2d7b5947cf8ca2ca5b27cc9bd85cec7a23a5039901e730ba20aad8c0c2","source":"CNMV_PORTAL","url":"https://www.cnmv.es/portal/consultas/iic/sgiic.aspx?nif=A83133421&vista=20"}],"status":{"as_of":"2026-09-18","basis":"OFFICIAL_AS_OF_STATE","value":"REGISTERED"},"timeline":[{"date_or_interval":"18/09/2025","evidence":"464b2690bb938ec6a9493887a881a71d1af7ab503a05add6aa0256bed40e4e03","kind":"OFFICIAL_AS_OF_STATE","summary":"Estado servido por la fuente para fs=18/09/2025: dirección «PASEO DE LA CASTELLANA, 92 - 28046 MADRID (MADRID)», capital 1.140.000,00"},{"date_or_interval":"18/09/2023","evidence":"9379ec226934bdc7b1f93c23d0fb0985b364464604f039fda3d9917ce8218b8b","kind":"OFFICIAL_AS_OF_STATE","summary":"Estado servido por la fuente para fs=18/09/2023: dirección «PASEO DE LA CASTELLANA, 92 - 28046 MADRID (MADRID)», capital 1.140.000,00"},{"date_or_interval":"18/09/2021","evidence":"62d6bba31b7266d0359b0f01c3999a129a40af09ea17999815aefa3c11154e09","kind":"OFFICIAL_AS_OF_STATE","summary":"Estado servido por la fuente para fs=18/09/2021: dirección «PASEO DE LA CASTELLANA, 92 - 28046 MADRID (MADRID)», capital 1.140.000,00"},{"date_or_interval":"25/01/2002","evidence":"4457d40bddb065ec8f88fab602735d250349132f658792af7e64e8d672d0c570","kind":"EXPLICIT_OFFICIAL_EVENT","summary":"Inscripción en el registro oficial CNMV nº 195"},{"date_or_interval":"22/03/2017","evidence":"vista_4","kind":"EXPLICIT_OFFICIAL_EVENT","summary":"Nombramiento: FERNANDEZ ELICES, DIEGO — PRESIDENTE"},{"date_or_interval":"01/12/2010","evidence":"vista_4","kind":"EXPLICIT_OFFICIAL_EVENT","summary":"Nombramiento: ESPEL SESE, JUAN — CONSEJERO"},{"date_or_interval":"22/03/2017","evidence":"vista_4","kind":"EXPLICIT_OFFICIAL_EVENT","summary":"Nombramiento: FERNANDEZ ELICES, DIEGO — CONSEJERO"},{"date_or_interval":"22/03/2017","evidence":"vista_4","kind":"EXPLICIT_OFFICIAL_EVENT","summary":"Nombramiento: SOLDEVILLA DIEGO, RAFAEL — CONSEJERO"}]}