{"coverage":{"branch":"NO_EVIDENCE","history":"NO HISTORICAL EVIDENCE","identity":"EXACT","passport":"NO_EVIDENCE","permission":"COVERED","provenance":"COVERED","registration":"COVERED","sanction":"NO_EVIDENCE","warning":"NO_EVIDENCE"},"freshness":{"last_successful_refresh":"2026-09-18T20:06:45Z","source_status":"OK"},"id":"esi-b22526768","identity":{"aliases":["101 FUTURES ASSET MANAGEMENT AV, S.L."],"identifiers":[{"scheme":"es:nif","value":"B22526768"},{"scheme":"cnmv:registro","value":"329"}],"legal_name":"101 FUTURES ASSET MANAGEMENT  AV, S.L.","resolution":"EXACT"},"locations":{"agents":[],"branches":[],"domicile":"C/ AZOR 7 - 28691 VILLANUEVA DE LA CAÑADA (MADRID)","passporting":[]},"managed_entities":[],"organisation":{"administrators":[{"appointed":"24/07/2025","name":"LOPEZ MORALEJA, JOSE CARLOS","role":"PRESIDENTE"},{"appointed":"24/07/2025","name":"LOPEZ MORALEJA, JOSE CARLOS","role":"CONSEJERO DELEGADO"},{"appointed":"24/07/2025","name":"LOPEZ MORALEJA, JOSE CARLOS","role":"DIRECTOR GENERAL"},{"appointed":"24/07/2025","name":"PARGA LANDA, MARÍA JOSÉ","role":"CONSEJERO"},{"appointed":"24/07/2025","name":"DIVASSON DEL FRAILE, PABLO","role":"CONSEJERO"},{"appointed":"24/07/2025","name":"BASCONES GOMEZ, JUAN","role":"CONSEJERO EJECUTIVO"}],"auditor":"Capital Auditors and Consultants, S.L.","audits":[{"auditor":"Capital Auditors and Consultants, S.L.","year":"2025"}],"customer_service":null,"shareholders":[{"name":"BASCONES GOMEZ, JUAN","pct":"5,00 %"},{"name":"DIVASSON DEL FRAILE, PABLO","pct":"5,00 %"},{"name":"LOPEZ MATEOS, PABLO CARLOS","pct":"5,00 %"},{"name":"LOPEZ MORALEJA, JOSE CARLOS","pct":"80,00 %"},{"name":"PARGA LANDA, MARÍA JOSÉ","pct":"5,00 %"}]},"permissions":[{"basis":"OFFICIAL_AS_OF_STATE","clients":["Profesionales"],"instruments":["a","b","c","d","e","f","g"],"kind":"investment","service":"Recepción y transmisión de órdenes de clientes","since":null},{"basis":"OFFICIAL_AS_OF_STATE","clients":["Profesionales"],"instruments":["a","b","c","d","e","f","g"],"kind":"investment","service":"Asesoramiento en materia de inversión","since":null},{"basis":"OFFICIAL_AS_OF_STATE","clients":["Profesionales","Contrapartes elegibles"],"instruments":[],"kind":"auxiliary","service":"Asesoramiento a empresas","since":null},{"basis":"OFFICIAL_AS_OF_STATE","clients":["Minoristas","Profesionales","Contrapartes elegibles"],"instruments":["a","b","c","d","e","f","g"],"kind":"auxiliary","service":"Elaboración de informes de inversiones y análisis financieros","since":null},{"basis":"OFFICIAL_AS_OF_STATE","clients":["Minoristas","Profesionales","Contrapartes elegibles"],"instruments":["e","f","g"],"kind":"auxiliary","service":"Los servicios y actividades de inversión así como los servicios auxiliares que se refieran al subyacente no financiero de los instrumentos financieros derivados","since":null}],"registrations":[{"basis":"OFFICIAL_AS_OF_STATE","date":"24/07/2025","number":"329","register":"CNMV_ESI","regulator":"CNMV","state":"INSCRITA"}],"regulatory_record":{"appeals":[],"candidates":[],"direct_warnings":[],"impersonations":[],"sanctions":[]},"schema":"regulatory-record-entity/v1","sources":[{"requested_fs":null,"retrieved_at":"2026-09-19T06:07:44Z","sha256":"12ea059c97e2de5b4d31202c0145b09d381e2d72377f5eb3bfea6157d4c0e2eb","source":"CNMV_PORTAL","url":"https://www.cnmv.es/Portal/Consultas/ESI/esis.aspx?nif=B22526768&vista=6"},{"requested_fs":null,"retrieved_at":"2026-09-19T06:07:46Z","sha256":"40ec95fd31cfb0ff399391d816c5bdeba621208ac7d835ade06faeafe60f850f","source":"CNMV_PORTAL","url":"https://www.cnmv.es/Portal/Consultas/ESI/esis.aspx?nif=B22526768&vista=10"},{"requested_fs":null,"retrieved_at":"2026-09-19T06:07:48Z","sha256":"d723b9ce773985d81f71d14ec3c7407997b6e47cf43edf5363bb4498efe64cab","source":"CNMV_PORTAL","url":"https://www.cnmv.es/Portal/Consultas/ESI/esis.aspx?nif=B22526768&vista=11"},{"requested_fs":null,"retrieved_at":"2026-09-19T06:07:49Z","sha256":"921533ab14db45121a3a1fab454480bfdd1db8bc551c4786022c3d7f28a80e83","source":"CNMV_PORTAL","url":"https://www.cnmv.es/Portal/Consultas/ESI/esis.aspx?nif=B22526768&vista=12"},{"requested_fs":null,"retrieved_at":"2026-09-19T06:07:51Z","sha256":"d7a981743397a46cc107dd2f38103c80759bf95d6c6483c38f511d468897338a","source":"CNMV_PORTAL","url":"https://www.cnmv.es/Portal/Consultas/ESI/esis.aspx?nif=B22526768&vista=13"},{"requested_fs":null,"retrieved_at":"2026-09-19T06:07:53Z","sha256":"e1283aae38063efda825a3487c6f862a715083534f3e54adf78c4141a54f10f5","source":"CNMV_PORTAL","url":"https://www.cnmv.es/Portal/Consultas/ESI/esis.aspx?nif=B22526768&vista=16"},{"requested_fs":null,"retrieved_at":"2026-09-19T06:07:54Z","sha256":"2bb44f09c6845c57e18282eed2c28e9e28ef3b3f5e49eea22a1385f40d993c86","source":"CNMV_PORTAL","url":"https://www.cnmv.es/Portal/Consultas/ESI/esis.aspx?nif=B22526768&vista=38"},{"requested_fs":null,"retrieved_at":"2026-09-18T20:06:45Z","sha256":"026014a5c5fc0d97fc6691a1a2cb180586d6177d5fafcb4d8d7c52e648b86605","source":"CNMV_PORTAL","url":"https://www.cnmv.es/Portal/Consultas/ESI/esis.aspx?nif=B22526768&vista=0"},{"requested_fs":null,"retrieved_at":"2026-09-18T20:06:47Z","sha256":"3f31de3ae4070b155cac56dfe24e7c8d629dcf9bfde87e04fa0536726198c9bd","source":"CNMV_PORTAL","url":"https://www.cnmv.es/Portal/Consultas/ESI/esis.aspx?nif=B22526768&vista=4"},{"requested_fs":null,"retrieved_at":"2026-09-18T20:06:49Z","sha256":"cd1d61483e0e27727f84af3e737aa9f6a2782eee8ecee06484b3a971b2c2d0dd","source":"CNMV_PORTAL","url":"https://www.cnmv.es/Portal/Consultas/ESI/esis.aspx?nif=B22526768&vista=7"},{"requested_fs":null,"retrieved_at":"2026-09-18T20:06:50Z","sha256":"5627e869fcfb58389df3dd055c663b15444f88cf895f3354e2d7b6fdb69bfac8","source":"CNMV_PORTAL","url":"https://www.cnmv.es/Portal/Consultas/ESI/esis.aspx?nif=B22526768&vista=8"},{"requested_fs":null,"retrieved_at":"2026-09-18T20:06:52Z","sha256":"fb66870caf81a4a9e40dbe0016f07efaf10457c7c7aeac9516128bcb60cff6fb","source":"CNMV_PORTAL","url":"https://www.cnmv.es/Portal/Consultas/ESI/esis.aspx?nif=B22526768&vista=9"},{"requested_fs":null,"retrieved_at":"2026-09-18T20:06:54Z","sha256":"ce7ad00701bcf803b1086446ac17f6ebe45a53f866980103ad4a369c34002226","source":"CNMV_PORTAL","url":"https://www.cnmv.es/Portal/Consultas/ESI/esis.aspx?nif=B22526768&vista=17"},{"requested_fs":"01/01/2020","retrieved_at":"2026-09-18T20:06:55Z","sha256":"f25ba82da46da76f9dc739b9b8b9298ba01b9f4972f5df8fce195e53f76da9e2","source":"CNMV_PORTAL","url":"https://www.cnmv.es/Portal/Consultas/ESI/esis.aspx?nif=B22526768&fs=01%2F01%2F2020"}],"status":{"as_of":"2026-09-18","basis":"OFFICIAL_AS_OF_STATE","value":"REGISTERED"},"timeline":[{"date_or_interval":"24/07/2025","evidence":"026014a5c5fc0d97fc6691a1a2cb180586d6177d5fafcb4d8d7c52e648b86605","kind":"EXPLICIT_OFFICIAL_EVENT","summary":"Inscripción en el registro oficial CNMV nº 329"},{"date_or_interval":"24/07/2025","evidence":"vista_4","kind":"EXPLICIT_OFFICIAL_EVENT","summary":"Nombramiento: LOPEZ MORALEJA, JOSE CARLOS — PRESIDENTE"},{"date_or_interval":"24/07/2025","evidence":"vista_4","kind":"EXPLICIT_OFFICIAL_EVENT","summary":"Nombramiento: LOPEZ MORALEJA, JOSE CARLOS — CONSEJERO DELEGADO"},{"date_or_interval":"24/07/2025","evidence":"vista_4","kind":"EXPLICIT_OFFICIAL_EVENT","summary":"Nombramiento: LOPEZ MORALEJA, JOSE CARLOS — DIRECTOR GENERAL"},{"date_or_interval":"24/07/2025","evidence":"vista_4","kind":"EXPLICIT_OFFICIAL_EVENT","summary":"Nombramiento: PARGA LANDA, MARÍA JOSÉ — CONSEJERO"},{"date_or_interval":"24/07/2025","evidence":"vista_4","kind":"EXPLICIT_OFFICIAL_EVENT","summary":"Nombramiento: DIVASSON DEL FRAILE, PABLO — CONSEJERO"},{"date_or_interval":"24/07/2025","evidence":"vista_4","kind":"EXPLICIT_OFFICIAL_EVENT","summary":"Nombramiento: BASCONES GOMEZ, JUAN — CONSEJERO EJECUTIVO"}]}