{"coverage":{"branch":"NO_EVIDENCE","history":"NO HISTORICAL EVIDENCE","identity":"EXACT","passport":"COVERED","permission":"COVERED","provenance":"COVERED","registration":"COVERED","sanction":"NO_EVIDENCE","warning":"NO_EVIDENCE"},"freshness":{"last_successful_refresh":"2026-09-18T20:06:57Z","source_status":"OK"},"id":"esi-a64911100","identity":{"aliases":["ACTIVOTRADE VALORES, SOCIEDAD DE VALORES, S.A."],"identifiers":[{"scheme":"es:nif","value":"A64911100"},{"scheme":"cnmv:registro","value":"239"}],"legal_name":"ACTIVOTRADE VALORES, SOCIEDAD DE VALORES, SOCIEDAD ANÓNIMA","resolution":"EXACT"},"locations":{"agents":[],"branches":[],"domicile":"Calle Caleruega 102, planta séptima - 28003 Madrid (Madrid)","passporting":[{"basis":"OFFICIAL_AS_OF_STATE","country":"PORTUGAL","mode":"FREEDOM_TO_PROVIDE_SERVICES","scope":"EEA"}]},"managed_entities":[],"organisation":{"administrators":[{"appointed":"09/07/2025","name":"ALONSO TRIGUERO, ADOLFO","role":"PRESIDENTE"},{"appointed":"24/07/2025","name":"ALONSO TRIGUERO, MARIA JESUS","role":"CONSEJERO DELEGADO"},{"appointed":"24/07/2025","name":"ALONSO TRIGUERO, ADOLFO","role":"CONSEJERO DELEGADO"},{"appointed":"25/04/2025","name":"ALONSO TRIGUERO, MARIA JESUS","role":"CONSEJERO"},{"appointed":"11/12/2025","name":"GARCIA REAL, JOSE LUIS","role":"CONSEJERO"},{"appointed":"09/07/2025","name":"ALONSO TRIGUERO, ADOLFO","role":"CONSEJERO EJECUTIVO"}],"auditor":"CAPITAL AUDITORS AND CONSULTANTS, S.L.","audits":[{"auditor":"CAPITAL AUDITORS AND CONSULTANTS, S.L.","year":"2025"},{"auditor":"CAPITAL AUDITORS AND CONSULTANTS, S.L.","year":"2024"},{"auditor":"CAPITAL AUDITORS AND CONSULTANTS, S.L.","year":"2023"},{"auditor":"CAPITAL AUDITORS AND CONSULTANTS, S.L.","year":"2022"},{"auditor":"BDO AUDITORES, S.L.P.","year":"2021"},{"auditor":"BDO","year":"2020"},{"auditor":"BDO","year":"2019"},{"auditor":"BDO","year":"2018"},{"auditor":"BDO AUDITORES","year":"2017"},{"auditor":"BDO AUDITORES","year":"2016"},{"auditor":"BDO AUDITORES","year":"2015"},{"auditor":"BDO AUDITORES","year":"2014"},{"auditor":"BDO AUDITORES SL","year":"2013"},{"auditor":"ACTIVOTRADE VALORES, AGENCIA DE VALORES, S.A.","year":"2012"}],"customer_service":{"address":"C/ CALERUEGA 102,7ª PLANTA","email":"atcliente@activotrade.com","locality":"Madrid","name":"RAMIREZ RICAUD, ALONSO","phone":"919496235","postal_code":"28033"},"shareholders":[{"name":"ALONSO TRIGUERO, ADOLFO","pct":"100,00 %"}]},"permissions":[{"basis":"OFFICIAL_AS_OF_STATE","clients":["Minoristas","Profesionales","Contrapartes elegibles"],"instruments":["a","b","c","d","e","f","i","j"],"kind":"investment","service":"Recepción y transmisión de órdenes de clientes","since":null},{"basis":"OFFICIAL_AS_OF_STATE","clients":["Minoristas","Profesionales","Contrapartes elegibles"],"instruments":["a","b","c","d","e","f","i","j"],"kind":"investment","service":"Ejecución de órdenes de clientes","since":null},{"basis":"OFFICIAL_AS_OF_STATE","clients":["Minoristas","Profesionales"],"instruments":["a","b","c","d","e","f","i","j"],"kind":"investment","service":"Negociación por cuenta propia","since":null},{"basis":"OFFICIAL_AS_OF_STATE","clients":["Minoristas","Profesionales","Contrapartes elegibles"],"instruments":["a","b","c","d","e","f","i","j"],"kind":"auxiliary","service":"Custodia y administración de instrumentos financieros","since":null},{"basis":"OFFICIAL_AS_OF_STATE","clients":["Minoristas","Profesionales","Contrapartes elegibles"],"instruments":[],"kind":"auxiliary","service":"Asesoramiento a empresas","since":null},{"basis":"OFFICIAL_AS_OF_STATE","clients":["Minoristas","Profesionales","Contrapartes elegibles"],"instruments":["a","b","c","d","e","f","i","j"],"kind":"auxiliary","service":"Elaboración de informes de inversiones y análisis financieros","since":null},{"basis":"OFFICIAL_AS_OF_STATE","clients":["Minoristas","Profesionales","Contrapartes elegibles"],"instruments":["a","b","c","d","e","f","i","j"],"kind":"auxiliary","service":"Servicios de cambios de divisas","since":null}],"registrations":[{"basis":"OFFICIAL_AS_OF_STATE","date":"15/01/2010","number":"239","register":"CNMV_ESI","regulator":"CNMV","state":"INSCRITA"}],"regulatory_record":{"appeals":[],"candidates":[],"direct_warnings":[],"impersonations":[],"sanctions":[]},"schema":"regulatory-record-entity/v1","sources":[{"requested_fs":null,"retrieved_at":"2026-09-19T06:07:56Z","sha256":"f7a4c8614e8d538c57bde53d62b39e3826445b9a7bf6f258b3bcf1ca45ad4e70","source":"CNMV_PORTAL","url":"https://www.cnmv.es/Portal/Consultas/ESI/esis.aspx?nif=A64911100&vista=6"},{"requested_fs":null,"retrieved_at":"2026-09-19T06:07:57Z","sha256":"74877fa63b9ef8cdb68c05e4fad067fbf28aaec34caa34d206b9735900304a6b","source":"CNMV_PORTAL","url":"https://www.cnmv.es/Portal/Consultas/ESI/esis.aspx?nif=A64911100&vista=10"},{"requested_fs":null,"retrieved_at":"2026-09-19T06:07:59Z","sha256":"caca73a286ec13411a81773a2bdcb2cd421f4cec85247a8cc51190240e1c71a1","source":"CNMV_PORTAL","url":"https://www.cnmv.es/Portal/Consultas/ESI/esis.aspx?nif=A64911100&vista=11"},{"requested_fs":null,"retrieved_at":"2026-09-19T06:08:01Z","sha256":"301773b45347b9e99f2e8a60254e8bfee839bc7acd7b193620259405d91ab5a5","source":"CNMV_PORTAL","url":"https://www.cnmv.es/Portal/Consultas/ESI/esis.aspx?nif=A64911100&vista=12"},{"requested_fs":null,"retrieved_at":"2026-09-19T06:08:02Z","sha256":"afd508d5dd47dd8398061df1f5a2396fdec234d7cf02851eb73ad4de1c4e880c","source":"CNMV_PORTAL","url":"https://www.cnmv.es/Portal/Consultas/ESI/esis.aspx?nif=A64911100&vista=13"},{"requested_fs":null,"retrieved_at":"2026-09-19T06:08:04Z","sha256":"7bd376e33aaadce1ee8a6e0fe2b9caa8af51c2ca9ce2a5e55b6a14568139b835","source":"CNMV_PORTAL","url":"https://www.cnmv.es/Portal/Consultas/ESI/esis.aspx?nif=A64911100&vista=16"},{"requested_fs":null,"retrieved_at":"2026-09-19T06:08:06Z","sha256":"1ddd530c5492c8f4a721316c3cdd77c4f163cb3691d98d4f489a3d8812b97f71","source":"CNMV_PORTAL","url":"https://www.cnmv.es/Portal/Consultas/ESI/esis.aspx?nif=A64911100&vista=38"},{"requested_fs":null,"retrieved_at":"2026-09-18T20:06:57Z","sha256":"4ecc2b976837dbc4654027809863d1f3e1a2cc65420b1a804f657f4d6be9ed56","source":"CNMV_PORTAL","url":"https://www.cnmv.es/Portal/Consultas/ESI/esis.aspx?nif=A64911100&vista=0"},{"requested_fs":null,"retrieved_at":"2026-09-18T20:06:59Z","sha256":"0e7615b0267b7163062f73f314a641ba3d875a84fb3f0c78cbc728bd3b9acded","source":"CNMV_PORTAL","url":"https://www.cnmv.es/Portal/Consultas/ESI/esis.aspx?nif=A64911100&vista=4"},{"requested_fs":null,"retrieved_at":"2026-09-18T20:07:00Z","sha256":"c64d3bf40a8b685087e5d7bcdd9048c4f72f2a570a3cf3d6776a3b07e818a311","source":"CNMV_PORTAL","url":"https://www.cnmv.es/Portal/Consultas/ESI/esis.aspx?nif=A64911100&vista=7"},{"requested_fs":null,"retrieved_at":"2026-09-18T20:07:02Z","sha256":"5e024d21f0673fea4a22781701b1516a4fb03a0fa574b66e5086874c67247d59","source":"CNMV_PORTAL","url":"https://www.cnmv.es/Portal/Consultas/ESI/esis.aspx?nif=A64911100&vista=8"},{"requested_fs":null,"retrieved_at":"2026-09-18T20:07:04Z","sha256":"7be1e3a0afe51ceff6b9cf3cb1437da2cc9f925bcf9fdee49da7dc4fc763756e","source":"CNMV_PORTAL","url":"https://www.cnmv.es/Portal/Consultas/ESI/esis.aspx?nif=A64911100&vista=9"},{"requested_fs":null,"retrieved_at":"2026-09-18T20:07:05Z","sha256":"fa59a6bf75e346c3c61b08aafd9ccdeb8d7aba2affd625561ba9bd5e56dbeb29","source":"CNMV_PORTAL","url":"https://www.cnmv.es/Portal/Consultas/ESI/esis.aspx?nif=A64911100&vista=17"},{"requested_fs":"01/01/2020","retrieved_at":"2026-09-18T20:07:07Z","sha256":"f25ba82da46da76f9dc739b9b8b9298ba01b9f4972f5df8fce195e53f76da9e2","source":"CNMV_PORTAL","url":"https://www.cnmv.es/Portal/Consultas/ESI/esis.aspx?nif=A64911100&fs=01%2F01%2F2020"}],"status":{"as_of":"2026-09-18","basis":"OFFICIAL_AS_OF_STATE","value":"REGISTERED"},"timeline":[{"date_or_interval":"15/01/2010","evidence":"4ecc2b976837dbc4654027809863d1f3e1a2cc65420b1a804f657f4d6be9ed56","kind":"EXPLICIT_OFFICIAL_EVENT","summary":"Inscripción en el registro oficial CNMV nº 239"},{"date_or_interval":"09/07/2025","evidence":"vista_4","kind":"EXPLICIT_OFFICIAL_EVENT","summary":"Nombramiento: ALONSO TRIGUERO, ADOLFO — PRESIDENTE"},{"date_or_interval":"24/07/2025","evidence":"vista_4","kind":"EXPLICIT_OFFICIAL_EVENT","summary":"Nombramiento: ALONSO TRIGUERO, MARIA JESUS — CONSEJERO DELEGADO"},{"date_or_interval":"24/07/2025","evidence":"vista_4","kind":"EXPLICIT_OFFICIAL_EVENT","summary":"Nombramiento: ALONSO TRIGUERO, ADOLFO — CONSEJERO DELEGADO"},{"date_or_interval":"25/04/2025","evidence":"vista_4","kind":"EXPLICIT_OFFICIAL_EVENT","summary":"Nombramiento: ALONSO TRIGUERO, MARIA JESUS — CONSEJERO"},{"date_or_interval":"11/12/2025","evidence":"vista_4","kind":"EXPLICIT_OFFICIAL_EVENT","summary":"Nombramiento: GARCIA REAL, JOSE LUIS — CONSEJERO"},{"date_or_interval":"09/07/2025","evidence":"vista_4","kind":"EXPLICIT_OFFICIAL_EVENT","summary":"Nombramiento: ALONSO TRIGUERO, ADOLFO — CONSEJERO EJECUTIVO"}]}