{"coverage":{"branch":"NO_EVIDENCE","history":"COVERED","identity":"EXACT","passport":"NO_EVIDENCE","permission":"NO_EVIDENCE","provenance":"COVERED","registration":"COVERED","sanction":"COVERED","warning":"NO_EVIDENCE"},"freshness":{"last_successful_refresh":"2026-09-18T20:07:20Z","source_status":"OK"},"id":"sgiic-a28867000","identity":{"aliases":[],"identifiers":[{"scheme":"es:nif","value":"A28867000"},{"scheme":"cnmv:registro","value":"57"}],"legal_name":"GESCONSULT, S.A., S.G.I.I.C.","resolution":"EXACT"},"locations":{"agents":[],"branches":[],"domicile":"Calle Serrano, número 37 - 28001 MADRID (MADRID)","passporting":"UNKNOWN"},"organisation":{"administrators":[{"appointed":"18/10/2024","name":"IGLESIAS ARAUZO, IGNACIO","role":"PRESIDENTE"},{"appointed":"18/10/2024","name":"DE ALARCÓN YÉCORA, JOSÉ","role":"DIRECTOR GENERAL"},{"appointed":"18/10/2024","name":"DE ALARCÓN YÉCORA, JOSÉ","role":"CONSEJERO"},{"appointed":"18/10/2024","name":"GARCIA ALEJO, JUAN LUIS","role":"CONSEJERO"},{"appointed":"18/10/2024","name":"IGLESIAS ARAUZO, IGNACIO","role":"CONSEJERO"},{"appointed":"21/06/2022","name":"NIETO RANERO, ARMANDO","role":"CONSEJERO"}],"shareholders":[{"name":"ANDBANK ESPAÑA BANCA PRIVADA, S.A.","pct":"80,02 %"},{"name":"DIVINA PASTORA SEGUROS, MUTUA DE SEGUROS","pct":"19,97 %"}]},"permissions":[],"registrations":[{"basis":"OFFICIAL_AS_OF_STATE","date":"12/02/1987","number":"57","register":"CNMV_SGIIC","regulator":"CNMV","state":"INSCRITA"}],"regulatory_record":{"appeals":[],"candidates":[],"direct_warnings":[],"impersonations":[],"sanctions":[{"basis":"OFFICIAL_DOCUMENT_DERIVATION","boe_reference":"BOE de 3 de agosto de 2026","register":"CNMV Registro publico de sanciones","register_date":"17/07/2026","resolution":"Resolucion de 17 de julio de 2026, CNMV, sanciones por infracciones muy grave y graves a Gesconsult, SA, SGIIC y a don Juan Llado Garcia-Lomas (BOE de 3 de agosto de 2026)"}]},"schema":"regulatory-record-entity/v1","sources":[{"requested_fs":null,"retrieved_at":"2026-09-18T20:07:20Z","sha256":"d55a3bbde90c59a51c0389cdbaadfa1ee9caf7e932844e9eeb502b2d10c22c67","source":"CNMV_PORTAL","url":"https://www.cnmv.es/portal/consultas/iic/sgiic.aspx?nif=A28867000"},{"requested_fs":"18/09/2025","retrieved_at":"2026-09-18T20:07:23Z","sha256":"ead7100c660d20394efe95674da4ec11952902e573ee5a9dda2761d34455c5ac","source":"CNMV_PORTAL","url":"https://www.cnmv.es/portal/consultas/iic/sgiic.aspx?nif=A28867000&fs=18%2F09%2F2025"},{"requested_fs":"18/09/2023","retrieved_at":"2026-09-18T20:07:25Z","sha256":"e6ccfb31cb6caa3c5b0047272ab59eda14481b3db4bea75d9002933076e9745f","source":"CNMV_PORTAL","url":"https://www.cnmv.es/portal/consultas/iic/sgiic.aspx?nif=A28867000&fs=18%2F09%2F2023"},{"requested_fs":"18/09/2021","retrieved_at":"2026-09-18T20:07:26Z","sha256":"bd2d3976cff2a1171318d89995ad3be7d52aef88754a68e7c9b5dd6543df8c83","source":"CNMV_PORTAL","url":"https://www.cnmv.es/portal/consultas/iic/sgiic.aspx?nif=A28867000&fs=18%2F09%2F2021"},{"requested_fs":null,"retrieved_at":"2026-09-18T20:07:28Z","sha256":"adf10af881c590bea96fe29157138b846bec9d06f74ccf35a232d6aecd374fed","source":"CNMV_PORTAL","url":"https://www.cnmv.es/portal/consultas/iic/sgiic.aspx?nif=A28867000&vista=4"},{"requested_fs":null,"retrieved_at":"2026-09-18T20:07:30Z","sha256":"401307ad323ee3fa29c9b508cbae1bc3eb5afc2fe1653b74f6489e186efc8909","source":"CNMV_PORTAL","url":"https://www.cnmv.es/portal/consultas/iic/sgiic.aspx?nif=A28867000&vista=7"},{"requested_fs":null,"retrieved_at":"2026-09-18T20:07:32Z","sha256":"91152aa5462b8dc7f15a8f7b24dc58449796cfeeb4075f7d2b7e5cdc242b32d1","source":"CNMV_PORTAL","url":"https://www.cnmv.es/portal/consultas/iic/sgiic.aspx?nif=A28867000&vista=9"},{"requested_fs":null,"retrieved_at":"2026-09-18T20:07:33Z","sha256":"86e62755ccc35cae44be9a1abd9d511aa4df19450a85aa0fb1cc361e8a508d55","source":"CNMV_PORTAL","url":"https://www.cnmv.es/portal/consultas/iic/sgiic.aspx?nif=A28867000&vista=17"},{"requested_fs":null,"retrieved_at":"2026-09-18T20:07:35Z","sha256":"1c836ea37bf5171cc3f5749235ee87eb502616a1ec4f36fa8f50eab824de59aa","source":"CNMV_PORTAL","url":"https://www.cnmv.es/portal/consultas/iic/sgiic.aspx?nif=A28867000&vista=20"},{"requested_fs":null,"retrieved_at":"2026-09-18T00:00:00Z","sha256":"f975a90a217690899ce26fa4154177c0ee929d8de1642f6ee428676d03129851","source":"CNMV_PORTAL","url":"https://www.cnmv.es/portal/consultas/registrosanciones/verregsanciones.aspx?page=0"},{"requested_fs":null,"retrieved_at":"2026-09-18T00:00:00Z","sha256":"c56636efdb7f6087170893848b32494748aa62ae8a0ddaacacd6a3df4a9c45bc","source":"CNMV_PORTAL","url":"https://www.cnmv.es/Portal/Consultas/RegistroSanciones/verRegSanciones.aspx"}],"status":{"as_of":"2026-09-18","basis":"OFFICIAL_AS_OF_STATE","value":"REGISTERED"},"timeline":[{"date_or_interval":"18/09/2025","evidence":"ead7100c660d20394efe95674da4ec11952902e573ee5a9dda2761d34455c5ac","kind":"OFFICIAL_AS_OF_STATE","summary":"Estado servido por la fuente para fs=18/09/2025: dirección «Calle Serrano, número 37 - 28001 MADRID (MADRID)», capital 474.034,32"},{"date_or_interval":"18/09/2023","evidence":"e6ccfb31cb6caa3c5b0047272ab59eda14481b3db4bea75d9002933076e9745f","kind":"OFFICIAL_AS_OF_STATE","summary":"Estado servido por la fuente para fs=18/09/2023: dirección «CALLE PRINCIPE DE VERGARA, 36, PISO 6º DERECHA - 28006 MADRID (MADRID)», capital 474.034,32"},{"date_or_interval":["18/09/2023","2026-09-18"],"evidence":"e6ccfb31cb6caa3c5b0047272ab59eda14481b3db4bea75d9002933076e9745f","kind":"OBSERVED_CHANGE","summary":"Cambio de dirección entre 18/09/2023 y la observación actual («CALLE PRINCIPE DE VERGARA, 36, PISO 6º DERECHA - 28006 MADRID (MADRID)» → «Calle Serrano, número 37 - 28001 MADRID (MADRID)»)"},{"date_or_interval":"18/09/2021","evidence":"bd2d3976cff2a1171318d89995ad3be7d52aef88754a68e7c9b5dd6543df8c83","kind":"OFFICIAL_AS_OF_STATE","summary":"Estado servido por la fuente para fs=18/09/2021: dirección «CALLE PRINCIPE DE VERGARA, 36, PISO 6º DERECHA - 28006 MADRID (MADRID)», capital 474.034,32"},{"date_or_interval":["18/09/2021","2026-09-18"],"evidence":"bd2d3976cff2a1171318d89995ad3be7d52aef88754a68e7c9b5dd6543df8c83","kind":"OBSERVED_CHANGE","summary":"Cambio de dirección entre 18/09/2021 y la observación actual («CALLE PRINCIPE DE VERGARA, 36, PISO 6º DERECHA - 28006 MADRID (MADRID)» → «Calle Serrano, número 37 - 28001 MADRID (MADRID)»)"},{"date_or_interval":"12/02/1987","evidence":"d55a3bbde90c59a51c0389cdbaadfa1ee9caf7e932844e9eeb502b2d10c22c67","kind":"EXPLICIT_OFFICIAL_EVENT","summary":"Inscripción en el registro oficial CNMV nº 57"},{"date_or_interval":"18/10/2024","evidence":"vista_4","kind":"EXPLICIT_OFFICIAL_EVENT","summary":"Nombramiento: IGLESIAS ARAUZO, IGNACIO — PRESIDENTE"},{"date_or_interval":"18/10/2024","evidence":"vista_4","kind":"EXPLICIT_OFFICIAL_EVENT","summary":"Nombramiento: DE ALARCÓN YÉCORA, JOSÉ — DIRECTOR GENERAL"},{"date_or_interval":"18/10/2024","evidence":"vista_4","kind":"EXPLICIT_OFFICIAL_EVENT","summary":"Nombramiento: DE ALARCÓN YÉCORA, JOSÉ — CONSEJERO"},{"date_or_interval":"18/10/2024","evidence":"vista_4","kind":"EXPLICIT_OFFICIAL_EVENT","summary":"Nombramiento: GARCIA ALEJO, JUAN LUIS — CONSEJERO"},{"date_or_interval":"18/10/2024","evidence":"vista_4","kind":"EXPLICIT_OFFICIAL_EVENT","summary":"Nombramiento: IGLESIAS ARAUZO, IGNACIO — CONSEJERO"},{"date_or_interval":"21/06/2022","evidence":"vista_4","kind":"EXPLICIT_OFFICIAL_EVENT","summary":"Nombramiento: NIETO RANERO, ARMANDO — CONSEJERO"},{"date_or_interval":"17/07/2026","evidence":"sanciones_registro","kind":"OFFICIAL_DOCUMENT_DERIVATION","summary":"Resolucion de 17 de julio de 2026, CNMV, sanciones por infracciones muy grave y graves a Gesconsult, SA, SGIIC y a don Juan Llado Garcia-Lomas (BOE de 3 de agosto de 2026)"}]}