{"coverage":{"branch":"NO_EVIDENCE","history":"NO HISTORICAL EVIDENCE","identity":"EXACT","passport":"NO_EVIDENCE","permission":"NO_EVIDENCE","provenance":"COVERED","registration":"COVERED","sanction":"NOT_REPRESENTABLE","warning":"NO_EVIDENCE"},"freshness":{"last_successful_refresh":"2026-09-11","source_status":"OK"},"id":"ins-c0002","identity":{"aliases":[],"identifiers":[{"country":"ES","scheme":"bde:european_code","value":"ESA28072197"},{"scheme":"bde:supervisor_code","value":"C0002"},{"scheme":"dgsfp:clave","value":"C0002"},{"country":"ES","scheme":"eiopa:identification_code","value":"C0002"},{"scheme":"es:nif","value":"A28072197"},{"scheme":"lei","value":"9598007S1Q7FKMLC0D44"}],"legal_name":"ALIANZA ESPAÑOLA S.A. DE SEGUROS LA","resolution":"EXACT"},"locations":{"agents":[],"branches":[],"domicile":"UNKNOWN","passporting":[]},"managed_entities":[],"organisation":{"administrators":[],"entity_kind":"INSURANCE_UNDERTAKING","shareholders":[]},"permissions":"UNKNOWN","registrations":[{"basis":"OFFICIAL_AS_OF_STATE","cancelled":null,"date":"14/04/1943","number":"ESA28072197","register":"BDE","register_type":"IC_LIST_ES","regulator":"DGSFP","state":null},{"basis":"OFFICIAL_AS_OF_STATE","cancelled":null,"date":"14/04/1943","number":"C0002","register":"DGSFP_RRPP","register_type":"C","regulator":"DGSFP","state":"Activa"},{"basis":"OFFICIAL_AS_OF_STATE","cancelled":null,"date":"14/04/1943","number":"C0002","register":"EIOPA","register_type":"HOME_UNDERTAKING","regulator":"DGSFP","state":null}],"regulatory_record":{"appeals":[],"candidates":[],"direct_warnings":[],"impersonations":[],"sanctions":[]},"schema":"regulatory-record-entity/v1","sources":[{"artifact":"data/derived/v0.1/opendgsfp-0.1.jsonl","schema":"opendgsfp/0.1","sha256":"10eb1274d3023fbb3e4bb81aff180d3353e889f64fd85c3eb62633fa367aec82","source":"OPENDGSFP"}],"status":{"as_of":"2026-09-11","basis":"OFFICIAL_AS_OF_STATE","source_value":"UNKNOWN","value":"REGISTERED"},"timeline":[{"date_or_interval":"2026-09-11","evidence":"as_6b92e039dc2abbac","kind":"OFFICIAL_AS_OF_STATE","summary":"Estado DGSFP «UNKNOWN» observado en snapshot 2026-09-11"},{"date_or_interval":"14/04/1943","evidence":"as_cbc9246b3b6645c5","kind":"EXPLICIT_OFFICIAL_EVENT","summary":"Autorización DGSFP (C0002)"}]}