{"coverage":{"branch":"NO_EVIDENCE","history":"NO HISTORICAL EVIDENCE","identity":"EXACT","passport":"NO_EVIDENCE","permission":"COVERED","provenance":"COVERED","registration":"COVERED","sanction":"NOT_REPRESENTABLE","warning":"NO_EVIDENCE"},"freshness":{"last_successful_refresh":"2026-09-18","source_status":"OK"},"id":"ede-6712","identity":{"aliases":[],"identifiers":[{"scheme":"es:nif","value":"A86969607"},{"scheme":"bde:codigo","value":"6712"},{"scheme":"eba:entity_code","value":"ES_BE!6712"},{"scheme":"lei","value":"959800X6U0L8VDFUGM56"}],"legal_name":"BIP & DRIVE E.D.E, S.A.","resolution":"EXACT"},"locations":{"agents":[],"branches":[],"domicile":"CALLE SERRANO 45    2ª PLANTA MADRID 28001","passporting":[]},"managed_entities":[],"organisation":{"administrators":[],"parent":null,"shareholders":[]},"permissions":[{"basis":"OFFICIAL_AS_OF_STATE","code":"A","norm":"LEY 21/2011, DE 26 DE JULIO, DE DINERO ELECTRÓNICO","service":"Emisión de dinero electrónico.","since":"14/01/2019"},{"basis":"OFFICIAL_AS_OF_STATE","code":"C","norm":"LEY 21/2011, DE 26 DE JULIO, DE DINERO ELECTRÓNICO","service":"Reembolso de dinero electrónico","since":"14/01/2019"},{"basis":"OFFICIAL_AS_OF_STATE","code":"3.B","norm":"LEY 21/2011, DE 26 DE JULIO, DE DINERO ELECTRÓNICO","service":"Ejecución de operaciones de pago, incluida la transferencia de fondos, a través de una cuenta de pago en el proveedor de servicios de pago del usuario u otro proveedor de servicios de pago - Ejecución de operaciones de pago mediante tarjeta de pago o dispositivo similar.","since":"23/05/2019"},{"basis":"OFFICIAL_AS_OF_STATE","code":"4.B","norm":"LEY 21/2011, DE 26 DE JULIO, DE DINERO ELECTRÓNICO","service":"Ejecución de operaciones de pago cuando los fondos están cubiertos por una línea de crédito abierta para un usuario de servicios de pago - Ejecución de operaciones de pago mediante tarjeta de pago o dispositivo similar.","since":"23/05/2019"},{"basis":"OFFICIAL_AS_OF_STATE","code":"5.A","norm":"LEY 21/2011, DE 26 DE JULIO, DE DINERO ELECTRÓNICO","service":"Emisión de instrumentos de pago o adquisición de operaciones de pago. - Emisión de instrumentos de pago.","since":"23/05/2019"},{"basis":"OFFICIAL_AS_OF_STATE","code":"5.B","norm":"LEY 21/2011, DE 26 DE JULIO, DE DINERO ELECTRÓNICO","service":"Emisión de instrumentos de pago o adquisición de operaciones de pago. - Adquisición de operaciones de pago.","since":"17/12/2019"}],"registrations":[{"basis":"OFFICIAL_AS_OF_STATE","date":"14/01/2019","number":"6712","register":"BDE_REGISTRO_SERVICIOS_PAGO","regulator":"Banco de España","state":"INSCRITA"},{"basis":"OFFICIAL_AS_OF_STATE","conflict_with":"bde:codigo","date":"2019-05-27","number":"ES_BE!6712","register":"EBA_PSD2_REGISTER","regulator":"EBA","state":"INSCRITA"}],"regulatory_record":{"appeals":[],"candidates":[],"direct_warnings":[],"impersonations":[],"sanctions":[]},"schema":"regulatory-record-entity/v1","sources":[{"artifact":"fixtures/g4/sources/raw/BDE__registro_serviciospagos.xlsx","as_of":"2026-09-17","retrieved_at":"G0","sha256":"b23db3e66134f479214a7ac3d74a93b3ed1804ecd7e0082c7dc2aa28d32f6a19","source":"BDE_REGISTRO_SERVICIOS_PAGO"},{"artifact":"fixtures\\g0.5\\sources\\raw\\h4-eba-psd2-20260913.zip","sha256":"948429ad71ea0ccbc03abe8d21eab7082075e09377874852b0fd265c2e0e1f31","source":"EBA_PSD2_REGISTER"}],"status":{"as_of":"2026-09-17","basis":"OFFICIAL_AS_OF_STATE","value":"REGISTERED"},"timeline":[{"date_or_interval":"14/01/2019","evidence":"b23db3e66134f479214a7ac3d74a93b3ed1804ecd7e0082c7dc2aa28d32f6a19","kind":"EXPLICIT_OFFICIAL_EVENT","summary":"Alta en el registro BdE de entidades de dinero electrónico (código 6712)"},{"date_or_interval":"14/01/2019","evidence":"b23db3e66134f479214a7ac3d74a93b3ed1804ecd7e0082c7dc2aa28d32f6a19","kind":"EXPLICIT_OFFICIAL_EVENT","summary":"Alta de actividad BdE: A Emisión de dinero electrónico."},{"date_or_interval":"14/01/2019","evidence":"b23db3e66134f479214a7ac3d74a93b3ed1804ecd7e0082c7dc2aa28d32f6a19","kind":"EXPLICIT_OFFICIAL_EVENT","summary":"Alta de actividad BdE: C Reembolso de dinero electrónico"},{"date_or_interval":"23/05/2019","evidence":"b23db3e66134f479214a7ac3d74a93b3ed1804ecd7e0082c7dc2aa28d32f6a19","kind":"EXPLICIT_OFFICIAL_EVENT","summary":"Alta de actividad BdE: 3.B Ejecución de operaciones de pago, incluida la transferencia de fondos, a través "},{"date_or_interval":"23/05/2019","evidence":"b23db3e66134f479214a7ac3d74a93b3ed1804ecd7e0082c7dc2aa28d32f6a19","kind":"EXPLICIT_OFFICIAL_EVENT","summary":"Alta de actividad BdE: 4.B Ejecución de operaciones de pago cuando los fondos están cubiertos por una línea"},{"date_or_interval":"23/05/2019","evidence":"b23db3e66134f479214a7ac3d74a93b3ed1804ecd7e0082c7dc2aa28d32f6a19","kind":"EXPLICIT_OFFICIAL_EVENT","summary":"Alta de actividad BdE: 5.A Emisión de instrumentos de pago o adquisición de operaciones de pago. - Emisión "},{"date_or_interval":"17/12/2019","evidence":"b23db3e66134f479214a7ac3d74a93b3ed1804ecd7e0082c7dc2aa28d32f6a19","kind":"EXPLICIT_OFFICIAL_EVENT","summary":"Alta de actividad BdE: 5.B Emisión de instrumentos de pago o adquisición de operaciones de pago. - Adquisic"},{"date_or_interval":"2019-05-27","evidence":"948429ad71ea0ccbc03abe8d21eab7082075e09377874852b0fd265c2e0e1f31","kind":"EXPLICIT_OFFICIAL_EVENT","summary":"Fecha ENT_AUT en el registro EBA PSD2 (difiere del alta BdE 14/01/2019; conflicto preservado)"}]}