{"coverage":{"branch":"NO_EVIDENCE","history":"NO HISTORICAL EVIDENCE","identity":"EXACT","passport":"NO_EVIDENCE","permission":"NO_EVIDENCE","provenance":"COVERED","registration":"COVERED","sanction":"NO_EVIDENCE","warning":"NO_EVIDENCE"},"freshness":{"last_successful_refresh":"2026-09-18T20:08:40Z","source_status":"OK"},"id":"sgiic-a84144625","identity":{"aliases":[],"identifiers":[{"scheme":"es:nif","value":"A84144625"},{"scheme":"cnmv:registro","value":"247"}],"legal_name":"ALTAMAR PRIVATE EQUITY, S.G.I.I.C., S.A.","resolution":"EXACT"},"locations":{"agents":[],"branches":[],"domicile":"Pº CASTELLANA, 91 - 28046 MADRID (MADRID)","passporting":"UNKNOWN"},"organisation":{"administrators":[{"appointed":"19/02/2016","name":"AGUIRRE PEMAN, CLAUDIO","role":"PRESIDENTE"},{"appointed":"19/02/2016","name":"AGUIRRE PEMAN, CLAUDIO","role":"CONSEJERO DELEGADO"},{"appointed":"19/02/2016","name":"MOLINA DOMINGUEZ, JOSE LUIS","role":"CONSEJERO DELEGADO"},{"appointed":"19/02/2016","name":"AGUIRRE PEMAN, CLAUDIO","role":"CONSEJERO"},{"appointed":"28/06/2019","name":"MALPICA ESTUDIO JURIDICO, S.L.","role":"CONSEJERO"},{"appointed":"19/02/2016","name":"MOLINA DOMINGUEZ, JOSE LUIS","role":"CONSEJERO"},{"appointed":"18/12/2018","name":"SANZ IRIBARREN, MARIA PILAR","role":"CONSEJERO"},{"appointed":"30/03/2016","name":"ZURITA GOÑI, MIGUEL","role":"CONSEJERO"},{"appointed":"30/03/2016","name":"SANZ IRIBARREN, MARIA PILAR","role":"VICESECRETARIO"}],"shareholders":[{"name":"ALTAMAR CAM PARTNERS, S.L.","pct":"100,00 %"}]},"permissions":[],"registrations":[{"basis":"OFFICIAL_AS_OF_STATE","date":"19/02/2016","number":"247","register":"CNMV_SGIIC","regulator":"CNMV","state":"INSCRITA"}],"regulatory_record":{"appeals":[],"candidates":[],"direct_warnings":[],"impersonations":[],"sanctions":[]},"schema":"regulatory-record-entity/v1","sources":[{"requested_fs":null,"retrieved_at":"2026-09-18T20:08:40Z","sha256":"784f399ff419bf711288469deca61417471d76d288da6c354fd5c95a6473e969","source":"CNMV_PORTAL","url":"https://www.cnmv.es/portal/consultas/iic/sgiic.aspx?nif=A84144625"},{"requested_fs":"18/09/2025","retrieved_at":"2026-09-18T20:08:41Z","sha256":"f017c2035dac41011ccd546d88694a7f0b477c37740ba027fe6158678387aae3","source":"CNMV_PORTAL","url":"https://www.cnmv.es/portal/consultas/iic/sgiic.aspx?nif=A84144625&fs=18%2F09%2F2025"},{"requested_fs":"18/09/2023","retrieved_at":"2026-09-18T20:08:43Z","sha256":"2dab751a78c20910d2ab2bd29aa58bccd931a42d2ed4d879ae5899ad55d7db58","source":"CNMV_PORTAL","url":"https://www.cnmv.es/portal/consultas/iic/sgiic.aspx?nif=A84144625&fs=18%2F09%2F2023"},{"requested_fs":"18/09/2021","retrieved_at":"2026-09-18T20:08:45Z","sha256":"8df35c3b5a9a65f0cabd3bf338d1862371544e0b39e7255bc8ebee8c3e9ae6f3","source":"CNMV_PORTAL","url":"https://www.cnmv.es/portal/consultas/iic/sgiic.aspx?nif=A84144625&fs=18%2F09%2F2021"},{"requested_fs":null,"retrieved_at":"2026-09-18T20:08:47Z","sha256":"0dc154a6187de42a848940a59ed2dcb5bf13fa6b4465a193eb168f6b10e21fbf","source":"CNMV_PORTAL","url":"https://www.cnmv.es/portal/consultas/iic/sgiic.aspx?nif=A84144625&vista=4"},{"requested_fs":null,"retrieved_at":"2026-09-18T20:08:49Z","sha256":"b502ee9445a2d2cebe2b1a5b1621abe4c387d88871dc3efa2cd62ac720906e35","source":"CNMV_PORTAL","url":"https://www.cnmv.es/portal/consultas/iic/sgiic.aspx?nif=A84144625&vista=7"},{"requested_fs":null,"retrieved_at":"2026-09-18T20:08:50Z","sha256":"b8652dea7d6034e71c9526558bfd279dba05181717409fe329659a5e16f01a5a","source":"CNMV_PORTAL","url":"https://www.cnmv.es/portal/consultas/iic/sgiic.aspx?nif=A84144625&vista=9"},{"requested_fs":null,"retrieved_at":"2026-09-18T20:08:52Z","sha256":"dd25924b3e54e76c11051469c0d09481d74d7d2256fcc775c32a9770752b04d8","source":"CNMV_PORTAL","url":"https://www.cnmv.es/portal/consultas/iic/sgiic.aspx?nif=A84144625&vista=17"},{"requested_fs":null,"retrieved_at":"2026-09-18T20:08:54Z","sha256":"995ad5495ad84fee5e4916fcd4f80e4ecb15dea2ba9d035309c0ab213a1e2cb3","source":"CNMV_PORTAL","url":"https://www.cnmv.es/portal/consultas/iic/sgiic.aspx?nif=A84144625&vista=20"}],"status":{"as_of":"2026-09-18","basis":"OFFICIAL_AS_OF_STATE","value":"REGISTERED"},"timeline":[{"date_or_interval":"18/09/2025","evidence":"f017c2035dac41011ccd546d88694a7f0b477c37740ba027fe6158678387aae3","kind":"OFFICIAL_AS_OF_STATE","summary":"Estado servido por la fuente para fs=18/09/2025: dirección «Pº CASTELLANA, 91 - 28046 MADRID (MADRID)», capital 310.510,00"},{"date_or_interval":"18/09/2023","evidence":"2dab751a78c20910d2ab2bd29aa58bccd931a42d2ed4d879ae5899ad55d7db58","kind":"OFFICIAL_AS_OF_STATE","summary":"Estado servido por la fuente para fs=18/09/2023: dirección «Pº CASTELLANA, 91 - 28046 MADRID (MADRID)», capital 310.510,00"},{"date_or_interval":"18/09/2021","evidence":"8df35c3b5a9a65f0cabd3bf338d1862371544e0b39e7255bc8ebee8c3e9ae6f3","kind":"OFFICIAL_AS_OF_STATE","summary":"Estado servido por la fuente para fs=18/09/2021: dirección «Pº CASTELLANA, 91 - 28046 MADRID (MADRID)», capital 310.510,00"},{"date_or_interval":"19/02/2016","evidence":"784f399ff419bf711288469deca61417471d76d288da6c354fd5c95a6473e969","kind":"EXPLICIT_OFFICIAL_EVENT","summary":"Inscripción en el registro oficial CNMV nº 247"},{"date_or_interval":"19/02/2016","evidence":"vista_4","kind":"EXPLICIT_OFFICIAL_EVENT","summary":"Nombramiento: AGUIRRE PEMAN, CLAUDIO — PRESIDENTE"},{"date_or_interval":"19/02/2016","evidence":"vista_4","kind":"EXPLICIT_OFFICIAL_EVENT","summary":"Nombramiento: AGUIRRE PEMAN, CLAUDIO — CONSEJERO DELEGADO"},{"date_or_interval":"19/02/2016","evidence":"vista_4","kind":"EXPLICIT_OFFICIAL_EVENT","summary":"Nombramiento: MOLINA DOMINGUEZ, JOSE LUIS — CONSEJERO DELEGADO"},{"date_or_interval":"19/02/2016","evidence":"vista_4","kind":"EXPLICIT_OFFICIAL_EVENT","summary":"Nombramiento: AGUIRRE PEMAN, CLAUDIO — CONSEJERO"},{"date_or_interval":"28/06/2019","evidence":"vista_4","kind":"EXPLICIT_OFFICIAL_EVENT","summary":"Nombramiento: MALPICA ESTUDIO JURIDICO, S.L. — CONSEJERO"},{"date_or_interval":"19/02/2016","evidence":"vista_4","kind":"EXPLICIT_OFFICIAL_EVENT","summary":"Nombramiento: MOLINA DOMINGUEZ, JOSE LUIS — CONSEJERO"},{"date_or_interval":"18/12/2018","evidence":"vista_4","kind":"EXPLICIT_OFFICIAL_EVENT","summary":"Nombramiento: SANZ IRIBARREN, MARIA PILAR — CONSEJERO"},{"date_or_interval":"30/03/2016","evidence":"vista_4","kind":"EXPLICIT_OFFICIAL_EVENT","summary":"Nombramiento: ZURITA GOÑI, MIGUEL — CONSEJERO"},{"date_or_interval":"30/03/2016","evidence":"vista_4","kind":"EXPLICIT_OFFICIAL_EVENT","summary":"Nombramiento: SANZ IRIBARREN, MARIA PILAR — VICESECRETARIO"}]}